{"budget":{"max_attempts":16,"max_cost_microusd":8000000,"max_input_tokens":262144,"max_output_tokens":131072,"max_wall_milliseconds":3600000},"call_timeout_milliseconds":180000,"configuration_id":"config.campaign.live.azure-openai.v2","content_hash":"sha256:4b3530ac2cb220f35e474136913144318d81d56fda3ea020cd981f94a7c47fcc","model_identifier":"gpt-5.6-sol","per_call_input_token_reserve":16384,"per_call_output_token_reserve":8192,"pricing_snapshot_id":"pricing.azure-openai.gpt5-6-sol.2026-08-21.v1","provider":"azure_openai","schema_version":"1.0.0"}
