{"budget":{"max_attempts":2,"max_cost_microusd":20000,"max_input_tokens":20000,"max_output_tokens":4096,"max_wall_milliseconds":300000},"call_timeout_milliseconds":120000,"configuration_id":"config.phase2.live.deepseek.v1","content_hash":"sha256:1a64f24ebfc6cca0c053b530451dd8ae22b1478bbf315515bcec114a89ea8732","model_identifier":"deepseek-v4-flash","per_call_input_token_reserve":10000,"per_call_output_token_reserve":2048,"pricing_snapshot_id":"pricing.deepseek.deepseek-v4-flash.2026-08-21.v1","provider":"deepseek","schema_version":"1.0.0"}
