{"budget":{"max_attempts":2,"max_cost_microusd":500000,"max_input_tokens":20000,"max_output_tokens":4096,"max_wall_milliseconds":300000},"call_timeout_milliseconds":120000,"configuration_id":"config.phase2.live.azure-openai.v1","content_hash":"sha256:64aee9dfa4e89de7691337f650cab082577102744427bbf9a66e24456f2e8dbf","model_identifier":"gpt-5.6-sol","per_call_input_token_reserve":10000,"per_call_output_token_reserve":2048,"pricing_snapshot_id":"pricing.azure-openai.gpt5-6-sol.2026-08-21.v1","provider":"azure_openai","schema_version":"1.0.0"}
