{
  "budget": {
    "max_attempts": 2,
    "max_cost_microusd": 20000,
    "max_input_tokens": 20000,
    "max_output_tokens": 4096,
    "max_wall_milliseconds": 300000
  },
  "call_timeout_milliseconds": 120000,
  "configuration_id": "config.phase2.live.gpt5-mini.v3",
  "content_hash": "sha256:03fcff9d4007985799bbf6b1e670a1b9c5900660ee444904c1bc681b04802da3",
  "model_identifier": "gpt-5-mini",
  "per_call_input_token_reserve": 10000,
  "per_call_output_token_reserve": 2048,
  "pricing_snapshot_id": "pricing.openai.gpt5-mini.2026-08-19.v1",
  "provider": "openai",
  "schema_version": "1.0.0"
}
