{"budget":{"max_attempts":2,"max_cost_microusd":404800,"max_input_tokens":20000,"max_output_tokens":4096,"max_wall_milliseconds":300000},"call_timeout_milliseconds":120000,"configuration_id":"config.phase2.live.anthropic.claude-opus-5.v1","content_hash":"sha256:60de2be5fa1e4ba00190a31900ff5cfa22d20642302b64ffab9855cb65f30bfe","model_identifier":"claude-opus-5","per_call_input_token_reserve":10000,"per_call_output_token_reserve":2048,"pricing_snapshot_id":"pricing.anthropic.claude-opus-5.2026-08-21.v1","provider":"anthropic","schema_version":"1.0.0"}