{"budget":{"max_attempts":2,"max_cost_microusd":30000,"max_input_tokens":20000,"max_output_tokens":4096,"max_wall_milliseconds":300000},"call_timeout_milliseconds":120000,"configuration_id":"config.phase2.live.minimax.v1","content_hash":"sha256:f715d17570e4cc7e5f9ed732cc9a25042c846f1548d3c299b0f8b18de37b56be","model_identifier":"MiniMax-M3","per_call_input_token_reserve":10000,"per_call_output_token_reserve":2048,"pricing_snapshot_id":"pricing.minimax.minimax-m3.2026-08-21.v1","provider":"minimax","schema_version":"1.0.0"}
