{"budget":{"max_attempts":2,"max_cost_microusd":20000,"max_input_tokens":20000,"max_output_tokens":4096,"max_wall_milliseconds":300000},"call_timeout_milliseconds":120000,"configuration_id":"config.phase2.live.bedrock.anthropic-claude-opus-5.v1","content_hash":"sha256:2687525501daf0616ab9c21a9949f6e07edf508c1edc1c99b8ec3d1502382b73","model_identifier":"anthropic.claude-opus-5","per_call_input_token_reserve":10000,"per_call_output_token_reserve":2048,"pricing_snapshot_id":"pricing.bedrock.anthropic-claude-opus-5.unconfirmed.2026-08-21.v1","provider":"bedrock","schema_version":"1.0.0"}
