{"budget":{"max_attempts":2,"max_cost_microusd":20000,"max_input_tokens":20000,"max_output_tokens":4096,"max_wall_milliseconds":300000},"call_timeout_milliseconds":120000,"configuration_id":"config.phase2.live.qwen-dashscope.v1","content_hash":"sha256:75ca2dfe063d555514da2df8f972d6f821588464d99b0dcece44fd45b35ca3e6","model_identifier":"qwen-plus","per_call_input_token_reserve":10000,"per_call_output_token_reserve":2048,"pricing_snapshot_id":"pricing.qwen-dashscope.qwen-plus.unconfirmed.2026-08-21.v1","provider":"qwen_dashscope","schema_version":"1.0.0"}
